{
  "$schema": "../../contracts/agent.schema.json",
  "id": "nino.orchestrator",
  "mode": "primary",
  "instructions": "AGENT.md",
  "capabilities": ["intent-routing", "capability-discovery", "task-dispatch", "result-reconciliation"],
  "allowed_skills": [],
  "allowed_tools": [],
  "allowed_delegates": [],
  "discover_delegates": true,
  "loop": {
    "max_actions": 12,
    "timeout_seconds": 180,
    "max_consecutive_failures": 2,
    "max_no_progress_steps": 2
  },
  "max_steps": 8,
  "max_delegation_depth": 1
}
